<?xml version="1.0" encoding="UTF-8"?>
<!DOCTYPE table PUBLIC "-//iptel.org//DTD DBSchema V1.0//EN"
  "http://iptel.org/dbschema/dtd/1.0/dbschema.dtd" [

<!ENTITY % entities SYSTEM "entities.xml">
%entities;

]>

<table xmlns:my="http://iptel.org/dbschema/mysql"
    xmlns:pg="http://iptel.org/dbschema/postgres"
    xmlns:dt="http://iptel.org/dbschema/dbtext">
    <name>silo</name>
    <version>4</version>

    <column id="silo.mid">
	<name>mid</name>
	<type>int</type>
	<my:type>INT AUTO_INCREMENT</my:type>
	<pg:type>SERIAL</pg:type>
	<dt:type>int,auto</dt:type>
    </column>

    <column>
	<name>from_hdr</name>
	<type>string</type>
	<size>255</size>
    </column>

    <column>
	<name>to_hdr</name>
	<type>string</type>
	<size>255</size>
    </column>

    <column>
	<name>ruri</name>
	<type>string</type>
	<size>&uri_len;</size>
    </column>

    <column>
	<name>uid</name>
	<type>string</type>
	<size>&id_len;</size>
    </column>

    <column>
	<name>inc_time</name>
	<type>datetime</type>
	<default>1970-01-01 00:00:00</default>
    </column>

    <column>
	<name>exp_time</name>
	<type>datetime</type>
	<default>1970-01-01 00:00:00</default>
    </column>

    <column>
	<name>ctype</name>
	<type>string</type>
	<default>text/plain</default>
	<size>128</size>
    </column>

    <column>
	<name>body</name>
	<type>binary</type>
	<default></default>
    </column>

    <index>
	<unique/>
	<name>silo_idx1</name>
	<colref linkend="silo.mid"/>
    </index>
</table>
